
Service,Headline 1,Headline 2,Headline 3,Headline 4,Headline 5,Headline 6,Headline 7,Headline 8,Headline 9,Headline 10,Headline 11,Headline 12,Headline 13,Headline 14,Headline 15,Description 1,Description 2,Description 3,Description 4
Location Services,Know Where Your Family Is,Real-Time Family Tracking,Family Location App - Free,See Your Family's Location,Arrival Alerts for Loved Ones,Track Family in Real Time,Family Safety App - Try Free,Live Location for Your Family,Family Peace of Mind - 24/7,Download Bond Free Today,AI-Powered Family Safety App,Instant Arrival Alerts,Unlimited Family Location,Get Alerts When They Arrive,Family Safety App - Download Now,Real-time family location & arrival alerts. Download Bond.,See where your family is at all times. Get arrival & departure alerts. Download Bond.,Track your family in real time. Bond alerts when loved ones arrive or leave. Download Bond.,Family location tracking & arrival alerts. Bond's free plan. Download today.
Track Me On The Go,Walk Home Safer Tonight,Bond Monitors Your Walk Home,Never Walk Alone Again,Live Agent Walks With You,Safe Walk Home App,Personal Safety App - Try Free,A Guardian in Your Pocket,Get Home Safe - Tap Bond,Late Night? Bond Has You.,We Watch Your Route 24/7,Track Me On The Go App,Safety App for Walking Alone,AI-Powered Walk Safety App,Rated 4.8 Stars - Download Now,Try Bond Free - 3 Days,Walking home alone? Bond monitors your route and agents respond if needed. Try free.,Bond's Track Me feature watches your walk. If you deviate or don't arrive we check in.,A live Bond agent stays with you until you're safely home. Tap once - try free 3 days.,AI + live agents monitor every step. If something's wrong we respond before you need 911.
Ready An Agent,Panic Button That Actually Works,Silent Safety Standby Mode,Discreet Emergency Safety App,Press & Hold - Agent on Call,Feel Unsafe? Don't Text. Tap.,Personal Security Standby,Silent Panic Button App,Agent on Standby in Seconds,Discreet Help - No Words Needed,Safety App with Panic Button,SOS App - Human Response,Get Help Without Speaking,Emergency Alert App - Try Free,Rated 4.8 Stars - Download Bond,Try Bond Free - 3 Days,When you feel unsafe but can't speak - Ready An Agent silently puts help on standby.,Bond's Ready An Agent puts a live security expert on alert - no words no attention drawn.,Press and hold to alert a live agent without a word. Bond acts if you don't respond.,Hold the button to put a live agent on standby - silently. Release to connect instantly.
Video Monitor Me,Live Agent Watches Over You,Virtual Security Escort App,Video Monitor: Real Agents,Real Person Watching You Live,Tap Once - Agent Appears,Live Security Video Monitoring,Safer in Seconds - Tap Bond,Not AI. A Real Human Agent.,Virtual Bodyguard App,24/7 Live Agent on Your Screen,Someone's With You - 24/7,Security Agents on Live Video,Real Agent. Real Time. Free Trial.,Rated 4.8 Stars - Download Bond,Try Bond Free - 3 Days,Live video security in your pocket. A Bond agent monitors your surroundings in real time.,Video Monitor Me: a live agent on your screen 24/7. Not a bot - a real security pro.,Not AI - a real agent monitors you via live video and responds if needed. Try free.,Tap Video Monitor Me - a live Bond Security Agent appears on screen and stays until safe.
Send Me A Car,Get a Safe Car in Seconds,Safe Ride - No App Needed,Emergency Ride Home App,Bond Sends a Car to You,Unsafe? We Send a Car.,No Rideshare Account Needed,Safe Ride - Agent Included,Escape Fast - Tap Bond,Security Car Dispatch App,Agent + Car - One Tap.,Leave Fast. Stay Safe.,Personal Security Car Service,Rated 4.8 Stars - Download Bond,Try Bond Free - 3 Days,Tap. Agent. Car. You're Safe.,Tap once. A Bond agent joins by video finds a safe place and sends a car to you.,Bond dispatches a car when you feel unsafe - no fumbling with apps no account required.,No Uber account needed. Bond sends a car when you need to leave fast. 24/7 live agents.,Feel unsafe? An agent joins via video and dispatches a car in minutes. No app account.
Siren,Turn Your Phone Into a Siren,Personal Alarm + Live Agents,Safety Siren App - Try Free,Loud Alarm. Instant Backup.,Personal Attack Alarm App,Deter Threats Instantly,Hold 3 Seconds - Siren On,Alarm + Agent in One App,Self-Defense Alarm App,Siren Alert + 24/7 Support,Lights. Sound. Agent Ready.,Emergency Phone Alarm App,More Than an Alarm - Bond,Rated 4.8 Stars - Download Bond,Try Bond Free - 3 Days,Hold 3 seconds to activate Siren - flashing lights and loud sound deter threats instantly.,Bond's Siren turns your phone into a personal alarm. Premium members get a live agent too.,Activate Siren to alert bystanders and deter threats. Bond agents respond if it escalates.,A loud alarm flashing lights and a live agent on standby - all in one tap. Try free.
Location Services (Premium),Bond: Premium Safety,Real-Time Family Map,AI Arrival Alerts,Private Family Tracker,Smart Family Security,Elite Family Locator,Secure Family Circle,Accurate Live Alerts,Professional Safety,Bond: Family Safety,Premium GPS Tracker,Your Private Family Map,Instant Safety Alerts,Bond: Elite Tracking,Modern Family Safety,Experience precision tracking with AI-powered arrival alerts. Secure private and ad-free.,Stop wondering. Get instant notifications when loved ones arrive or leave. Try Bond today.,Professional-grade family safety. High-accuracy location sharing without selling your data.,The premium choice for family security. Real-time updates and elite battery optimization.
